{
  "vulnerability_id": "VULN-004",
  "root_cause": "Missing extension allowlist check in uploadProfileFile.",
  "files_changed": [
    "target_app/backend/src/controllers/upload.ts"
  ],
  "fix_description": "Added file extension validation rejecting script and executable formats.",
  "regression_test_file": "blue_team/tests/test_regression_vuln-004.py",
  "status": "PATCHED"
}