{
  "vulnerability_id": "VULN-001",
  "root_cause": "Authorization check disabled in getProfile controller (target_app/backend/src/controllers/user.ts).",
  "files_changed": [
    "target_app/backend/src/controllers/user.ts"
  ],
  "fix_description": "Enforced req.user.id !== userId check to return 403 Forbidden for unauthorized profile requests.",
  "regression_test_file": "blue_team/tests/test_regression_vuln-001.py",
  "status": "PATCHED"
}